{
  "leji": "1.0",
  "name": "host",
  "rootPath": "docs/",
  "bootProfilePath": "docs/boot-profile.md",
  "categories": {},
  "owners": { "primary": { "name": "product-context" } },
  "federation": {
    "mounts": [
      {
        "name": "product-context",
        "source": "https://github.com/acme/product-context",
        "pin": "4e974570000000000000000000000000000000aa",
        "trackingRef": "refs/heads/main",
        "owner": { "name": "product-context" }
      }
    ]
  }
}
