{
  "leji": "1.0",
  "name": "fixture",
  "rootPath": "docs/",
  "bootProfilePath": "docs/boot-profile.md",
  "categories": {
    "domain": {
      "indexes": [
        "docs/context/domain.md"
      ]
    },
    "decisions": {
      "indexes": [
        "docs/context/decisions.md"
      ]
    }
  },
  "agents": {
    "default": "docs/agents/default.md"
  },
  "owners": {
    "primary": {
      "name": "Fixture Owner"
    }
  }
}
