{
  "leji": "1.0",
  "name": "fixture",
  "rootPath": "docs/",
  "bootProfilePath": "docs/boot-profile.md",
  "categories": {
    "domain": {
      "indexes": [
        "docs/context/domain.md"
      ]
    },
    "decisions": {
      "indexes": [
        "docs/context/decisions.md"
      ]
    }
  },
  "owners": {
    "primary": {
      "name": "Fixture Owner"
    }
  },
  "conformance": {
    "claimedLevel": "federated"
  },
  "machine": {
    "indexPath": "docs/context-index.json",
    "changelogPath": "docs/context-changelog.json",
    "agentProfilesPath": "docs/agents/"
  },
  "agents": {
    "core": "docs/agents/core.md"
  },
  "federation": {
    "mounts": [
      {
        "name": "product-context",
        "source": "https://github.com/acme/product-context",
        "pin": "4e974570000000000000000000000000000000aa",
        "owner": {
          "name": "Product Owner"
        },
        "categories": [
          "domain"
        ],
        "topics": [
          "product behavior",
          "product terminology"
        ]
      }
    ]
  }
}
