{
  "leji": "1.0",
  "name": "fixture",
  "rootPath": "docs/",
  "bootProfilePath": "docs/boot-profile.md",
  "categories": {
    "domain": {
      "indexes": [
        "docs/context/domain.md"
      ]
    },
    "decisions": {
      "indexes": [
        "docs/context/decisions.md"
      ]
    }
  },
  "owners": {
    "primary": {
      "name": "Fixture Owner"
    }
  },
  "conformance": {
    "claimedLevel": "indexed"
  },
  "machine": {
    "indexPath": "docs/context-index.json",
    "changelogPath": "docs/context-changelog.json"
  }
}
