{
  "$schema": "https://leji.org/schemas/v1.0/context-manifest.schema.json",
  "leji": "1.0",
  "name": "leji",
  "description": "Context layer for the Leji repository: the specification, the reference SDKs and tooling, and the leji.org site.",
  "rootPath": "docs/",
  "bootProfilePath": "docs/boot-profile.md",
  "categories": {
    "domain": {
      "indexes": [
        "docs/context/domain.md"
      ]
    },
    "system": {
      "indexes": [
        "docs/context/system.md"
      ]
    },
    "practice": {
      "indexes": [
        "docs/context/practice.md"
      ]
    },
    "decisions": {
      "indexes": [
        "docs/context/decisions.md"
      ]
    }
  },
  "machine": {
    "indexPath": "docs/context-index.json",
    "changelogPath": "docs/context-changelog.json",
    "agentProfilesPath": "docs/agents/",
    "decisionRecordsPath": "docs/decisions/"
  },
  "agents": {
    "porter": "docs/agents/porter.md",
    "reviewer": "docs/agents/reviewer.md"
  },
  "owners": {
    "primary": {
      "name": "Vuong Nguyen",
      "contact": "hello@leji.org"
    }
  },
  "conformance": {
    "claimedLevel": "governed",
    "claimedAt": "2026-06-21"
  }
}
